{
  "entries": [
    {
      "kind": "episode_id",
      "source": "v1-openhands-training-and-sealed-repo-boundary",
      "value": "006ec4ab-4a01-4556-ab4c-e8d4dde77dfd"
    },
    {
      "kind": "episode_id",
      "source": "v1-openhands-training-and-sealed-repo-boundary",
      "value": "00bc042e-d156-4662-8d0d-363b060f1713"
    },
    {
      "kind": "episode_id",
      "source": "v1-openhands-training-and-sealed-repo-boundary",
      "value": "02062651-e245-4c51-a8d4-1e9f6b7701db"
    },
    {
      "kind": "episode_id",
      "source": "v1-openhands-training-and-sealed-repo-boundary",
      "value": "05d54797-80cc-48d4-962a-a73bfbd88cdc"
    },
    {
      "kind": "episode_id",
      "source": "v1-openhands-training-and-sealed-repo-boundary",
      "value": "0605e8ee-6173-486c-a702-1877c64b20b0"
    },
    {
      "kind": "episode_id",
      "source": "v1-openhands-training-and-sealed-repo-boundary",
      "value": "0b6972a5-8046-42a1-bb2b-498c3a94a9de"
    },
    {
      "kind": "episode_id",
      "source": "v1-openhands-training-and-sealed-repo-boundary",
      "value": "0ce2a6fa-e77a-45dc-bf62-8862d75d8322"
    },
    {
      "kind": "episode_id",
      "source": "v1-openhands-training-and-sealed-repo-boundary",
      "value": "0da6622a-eb12-4f03-9128-e97823fe48a2"
    },
    {
      "kind": "episode_id",
      "source": "v1-openhands-training-and-sealed-repo-boundary",
      "value": "0ddec621-9994-4c00-a5ff-d00064cdabcc"
    },
    {
      "kind": "episode_id",
      "source": "v1-openhands-training-and-sealed-repo-boundary",
      "value": "0e2f362d-6df6-416e-afd2-9d62df6a91a2"
    },
    {
      "kind": "episode_id",
      "source": "v1-openhands-training-and-sealed-repo-boundary",
      "value": "0fb4a9eb-6bb7-4aba-b469-4ed080ccd4e5"
    },
    {
      "kind": "episode_id",
      "source": "v1-openhands-training-and-sealed-repo-boundary",
      "value": "103c19f0-433d-4e42-86b9-6d34d39d670f"
    },
    {
      "kind": "episode_id",
      "source": "v1-openhands-training-and-sealed-repo-boundary",
      "value": "109554b7-5571-40fc-a0f4-680574ca57d5"
    },
    {
      "kind": "episode_id",
      "source": "v1-openhands-training-and-sealed-repo-boundary",
      "value": "1167df84-1c8c-4268-bbcd-800e5cdedba1"
    },
    {
      "kind": "episode_id",
      "source": "v1-openhands-training-and-sealed-repo-boundary",
      "value": "117c595b-36cb-4c0f-a726-c2223d920f90"
    },
    {
      "kind": "episode_id",
      "source": "v1-openhands-training-and-sealed-repo-boundary",
      "value": "1346d1cd-7173-498f-b482-ffb83704b33c"
    },
    {
      "kind": "episode_id",
      "source": "v1-openhands-training-and-sealed-repo-boundary",
      "value": "13e63621-1eea-484b-b541-cf5cbc212b3e"
    },
    {
      "kind": "episode_id",
      "source": "v1-openhands-training-and-sealed-repo-boundary",
      "value": "176b0912-1709-4414-a71d-7088d0a07b37"
    },
    {
      "kind": "episode_id",
      "source": "v1-openhands-training-and-sealed-repo-boundary",
      "value": "17b33173-9d98-4555-b998-28026dc2b1c7"
    },
    {
      "kind": "episode_id",
      "source": "v1-openhands-training-and-sealed-repo-boundary",
      "value": "17f88a30-ce85-4a9b-8cb6-4b117851ea2a"
    },
    {
      "kind": "episode_id",
      "source": "v1-openhands-training-and-sealed-repo-boundary",
      "value": "1804b0a4-b32e-44b1-a1a1-da14a66dd827"
    },
    {
      "kind": "episode_id",
      "source": "v1-openhands-training-and-sealed-repo-boundary",
      "value": "1831a098-c16e-4c68-b48b-977153753411"
    },
    {
      "kind": "episode_id",
      "source": "v1-openhands-training-and-sealed-repo-boundary",
      "value": "18785994-776e-409c-8d16-c8134f840ada"
    },
    {
      "kind": "episode_id",
      "source": "v1-openhands-training-and-sealed-repo-boundary",
      "value": "19e2b758-ad9e-46e1-bdb9-c4d6ab356c3e"
    },
    {
      "kind": "episode_id",
      "source": "v1-openhands-training-and-sealed-repo-boundary",
      "value": "1af308c4-aeac-4155-a0b4-0805e411e0a9"
    },
    {
      "kind": "episode_id",
      "source": "v1-openhands-training-and-sealed-repo-boundary",
      "value": "1d3300dd-7407-4357-920e-3fabfe46f926"
    },
    {
      "kind": "episode_id",
      "source": "v1-openhands-training-and-sealed-repo-boundary",
      "value": "1db54ec3-1b89-4f60-bd04-cb181f666a46"
    },
    {
      "kind": "episode_id",
      "source": "v1-openhands-training-and-sealed-repo-boundary",
      "value": "1dece499-b65f-4328-bb28-95acb8f3a46c"
    },
    {
      "kind": "episode_id",
      "source": "v1-openhands-training-and-sealed-repo-boundary",
      "value": "1f166a14-3be9-4c68-98f6-f8a23f1c7b01"
    },
    {
      "kind": "episode_id",
      "source": "v1-openhands-training-and-sealed-repo-boundary",
      "value": "1f3feaf3-5ec1-4e79-89e9-fab739d8c457"
    },
    {
      "kind": "episode_id",
      "source": "v1-openhands-training-and-sealed-repo-boundary",
      "value": "204c12a8-934b-49f4-8fca-9efbde332acb"
    },
    {
      "kind": "episode_id",
      "source": "v1-openhands-training-and-sealed-repo-boundary",
      "value": "205a5f3e-9f48-4b98-aa67-ea8847b2b30c"
    },
    {
      "kind": "episode_id",
      "source": "v1-openhands-training-and-sealed-repo-boundary",
      "value": "22d5e3e7-ebaf-4b63-b501-fec7afbcbbb0"
    },
    {
      "kind": "episode_id",
      "source": "v1-openhands-training-and-sealed-repo-boundary",
      "value": "232c6585-ed36-4247-b4b5-bde573aad261"
    },
    {
      "kind": "episode_id",
      "source": "v1-openhands-training-and-sealed-repo-boundary",
      "value": "24207cac-6965-488a-a21e-bdbe39a768f4"
    },
    {
      "kind": "episode_id",
      "source": "v1-openhands-training-and-sealed-repo-boundary",
      "value": "2503ee81-5905-4674-b16f-d0256d9621d0"
    },
    {
      "kind": "episode_id",
      "source": "v1-openhands-training-and-sealed-repo-boundary",
      "value": "25f7c527-3cb1-434a-b22b-23aa00ec0a88"
    },
    {
      "kind": "episode_id",
      "source": "v1-openhands-training-and-sealed-repo-boundary",
      "value": "270fcc4c-3416-47b0-998c-4a25ca4291b5"
    },
    {
      "kind": "episode_id",
      "source": "v1-openhands-training-and-sealed-repo-boundary",
      "value": "298d0acb-909e-46e2-b086-07a8c0b73339"
    },
    {
      "kind": "episode_id",
      "source": "v1-openhands-training-and-sealed-repo-boundary",
      "value": "2a2a15ce-eb49-40a1-957a-1e7549e8b55b"
    },
    {
      "kind": "episode_id",
      "source": "v1-openhands-training-and-sealed-repo-boundary",
      "value": "2a638385-bcc7-48ac-97df-529088addde3"
    },
    {
      "kind": "episode_id",
      "source": "v1-openhands-training-and-sealed-repo-boundary",
      "value": "2ae659f1-de39-4466-a4b8-d6d7181682ed"
    },
    {
      "kind": "episode_id",
      "source": "v1-openhands-training-and-sealed-repo-boundary",
      "value": "2b15102e-97ff-40d5-9cc0-e582522583ec"
    },
    {
      "kind": "episode_id",
      "source": "v1-openhands-training-and-sealed-repo-boundary",
      "value": "2c08bcb3-27a8-4121-90de-22f8041d06af"
    },
    {
      "kind": "episode_id",
      "source": "v1-openhands-training-and-sealed-repo-boundary",
      "value": "2dafac70-29ee-469c-8909-5f3f933e292c"
    },
    {
      "kind": "episode_id",
      "source": "v1-openhands-training-and-sealed-repo-boundary",
      "value": "2e68aa5e-4691-49aa-94af-498e007720ed"
    },
    {
      "kind": "episode_id",
      "source": "v1-openhands-training-and-sealed-repo-boundary",
      "value": "2f1f00a3-00a1-4613-90ba-979798ee9868"
    },
    {
      "kind": "episode_id",
      "source": "v1-openhands-training-and-sealed-repo-boundary",
      "value": "301ed89c-65f0-4d63-af28-72b8143c473f"
    },
    {
      "kind": "episode_id",
      "source": "v1-openhands-training-and-sealed-repo-boundary",
      "value": "313b5ebb-d732-4cb0-b673-cb12a1c65fff"
    },
    {
      "kind": "episode_id",
      "source": "v1-openhands-training-and-sealed-repo-boundary",
      "value": "31e2a752-d700-477c-ad22-a911d8041555"
    },
    {
      "kind": "episode_id",
      "source": "v1-openhands-training-and-sealed-repo-boundary",
      "value": "35245d9c-d2a3-4116-be66-de54bb93d7c9"
    },
    {
      "kind": "episode_id",
      "source": "v1-openhands-training-and-sealed-repo-boundary",
      "value": "355c3e7f-9752-4d72-9dbb-3b035dd2c45f"
    },
    {
      "kind": "episode_id",
      "source": "v1-openhands-training-and-sealed-repo-boundary",
      "value": "35f49e47-6fc0-40c8-9e2b-d7b1a78ace2f"
    },
    {
      "kind": "episode_id",
      "source": "v1-openhands-training-and-sealed-repo-boundary",
      "value": "387b9bc3-d7ca-4bfd-9712-6e992849402c"
    },
    {
      "kind": "episode_id",
      "source": "v1-openhands-training-and-sealed-repo-boundary",
      "value": "38a3af23-0bfa-4506-9e03-c7290e1ce8fa"
    },
    {
      "kind": "episode_id",
      "source": "v1-openhands-training-and-sealed-repo-boundary",
      "value": "3a20c885-cc14-4b01-8549-ad6169cbb746"
    },
    {
      "kind": "episode_id",
      "source": "v1-openhands-training-and-sealed-repo-boundary",
      "value": "41e5555c-69ed-42c5-a3f7-15afbcaca699"
    },
    {
      "kind": "episode_id",
      "source": "v1-openhands-training-and-sealed-repo-boundary",
      "value": "42d59211-fee1-49a7-9191-77b1a1149bb5"
    },
    {
      "kind": "episode_id",
      "source": "v1-openhands-training-and-sealed-repo-boundary",
      "value": "443a4c99-a9a3-4812-a3b3-68d9629ed505"
    },
    {
      "kind": "episode_id",
      "source": "v1-openhands-training-and-sealed-repo-boundary",
      "value": "46b162cc-6bbb-457d-8085-661a2673889c"
    },
    {
      "kind": "episode_id",
      "source": "v1-openhands-training-and-sealed-repo-boundary",
      "value": "48243376-1705-4fad-b1c6-31f119a50a82"
    },
    {
      "kind": "episode_id",
      "source": "v1-openhands-training-and-sealed-repo-boundary",
      "value": "4872b036-af4a-4497-84a0-c252050200f6"
    },